[
  {
    "schema_version": "1.0",
    "calculation_id": "calc_a2efb68f034bb5a8",
    "signal_family": "renewable_transition",
    "name": "re_share_of_group_pipeline",
    "status": "computed",
    "formula": "re_under_implementation_group / total_under_implementation_group x 100",
    "inputs": [
      {
        "name": "re_under_implementation_group",
        "value": 14.5,
        "unit": "GW",
        "as_of_date": "2025-03-31",
        "period_text": "As on 31 March 2025",
        "basis": "group",
        "statement_status": "under_implementation",
        "claim_ids": [
          "cl1_0f2c466c2859d4c9cc88f4b8"
        ],
        "verification_ids": [
          "ver_re_pipeline_group_cc88f4b8_text",
          "ver_re_pipeline_group_ntpc_ar_fy2024_25"
        ],
        "verification_outcome": "partially_supported",
        "rounding_uncertainty": 0.05
      },
      {
        "name": "total_under_implementation_group",
        "value": 33671.0,
        "unit": "MW",
        "as_of_date": "2025-03-31",
        "period_text": "As on 31 March 2025",
        "basis": "group",
        "statement_status": "under_implementation",
        "claim_ids": [
          "cl1_09d1b0c61a44466b711c57e9"
        ],
        "verification_ids": [
          "ver_pipeline_total_group_711c57e9_text",
          "ver_pipeline_total_group_ntpc_ar_fy2024_25"
        ],
        "verification_outcome": "partially_supported",
        "rounding_uncertainty": null
      }
    ],
    "result": {
      "value": 43.063764,
      "unit": "percent",
      "lower_bound": 42.915268,
      "upper_bound": 43.21226
    },
    "compatibility_checks": [
      {
        "check": "input_verified:re_under_implementation_group",
        "ok": true,
        "detail": "verification outcome = partially_supported"
      },
      {
        "check": "input_verified:total_under_implementation_group",
        "ok": true,
        "detail": "verification outcome = partially_supported"
      },
      {
        "check": "units_compatible",
        "ok": true,
        "detail": "MW vs MW"
      },
      {
        "check": "same_as_of_date",
        "ok": true,
        "detail": "2025-03-31 vs 2025-03-31"
      },
      {
        "check": "basis_compatible",
        "ok": true,
        "detail": "group / group (allowed: [\"('group', 'group')\"])"
      },
      {
        "check": "statement_status_compatible",
        "ok": true,
        "detail": "under_implementation / under_implementation"
      },
      {
        "check": "denominator_nonzero",
        "ok": true,
        "detail": "denominator = 33671.0"
      }
    ],
    "assumptions": [
      "Inputs are used as verified at their stated verification level."
    ],
    "missing_inputs": [],
    "counterargument": "Pipeline entries may be at different stages and can slip or be cancelled.",
    "falsification_test": "The filing's component table does not sum to the total, or the renewable total is defined differently from the pipeline total.",
    "trace": "re_under_implementation_group = 14500 MW (14.5 GW); total_under_implementation_group = 33671 MW; 100 x 14500 / 33671 = 43.0638%; rounding bounds [42.9153%, 43.2123%]",
    "synthetic": false
  },
  {
    "schema_version": "1.0",
    "calculation_id": "calc_91b9cf3fdf51bc35",
    "signal_family": "subsidiary_jv_exposure",
    "name": "jv_subsidiary_share_of_re_pipeline",
    "status": "computed",
    "formula": "re_under_implementation_jv_subsidiary / re_under_implementation_group x 100",
    "inputs": [
      {
        "name": "re_under_implementation_jv_subsidiary",
        "value": 13791.0,
        "unit": "MW",
        "as_of_date": "2025-03-31",
        "period_text": "As on 31 March 2025",
        "basis": "jv_subsidiary_part",
        "statement_status": "under_implementation",
        "claim_ids": [
          "cl1_7904a68ca446b6be755a6e95"
        ],
        "verification_ids": [
          "ver_re_pipeline_jv_sub_755a6e95_text",
          "ver_re_pipeline_jv_sub_ntpc_ar_fy2024_25"
        ],
        "verification_outcome": "partially_supported",
        "rounding_uncertainty": null
      },
      {
        "name": "re_under_implementation_group",
        "value": 14.5,
        "unit": "GW",
        "as_of_date": "2025-03-31",
        "period_text": "As on 31 March 2025",
        "basis": "group",
        "statement_status": "under_implementation",
        "claim_ids": [
          "cl1_0f2c466c2859d4c9cc88f4b8"
        ],
        "verification_ids": [
          "ver_re_pipeline_group_cc88f4b8_text",
          "ver_re_pipeline_group_ntpc_ar_fy2024_25"
        ],
        "verification_outcome": "partially_supported",
        "rounding_uncertainty": 0.05
      }
    ],
    "result": {
      "value": 95.110345,
      "unit": "percent",
      "lower_bound": 94.783505,
      "upper_bound": 95.439446
    },
    "compatibility_checks": [
      {
        "check": "input_verified:re_under_implementation_jv_subsidiary",
        "ok": true,
        "detail": "verification outcome = partially_supported"
      },
      {
        "check": "input_verified:re_under_implementation_group",
        "ok": true,
        "detail": "verification outcome = partially_supported"
      },
      {
        "check": "units_compatible",
        "ok": true,
        "detail": "MW vs MW"
      },
      {
        "check": "same_as_of_date",
        "ok": true,
        "detail": "2025-03-31 vs 2025-03-31"
      },
      {
        "check": "basis_compatible",
        "ok": true,
        "detail": "jv_subsidiary_part / group (allowed: [\"('jv_subsidiary_part', 'group')\"])"
      },
      {
        "check": "statement_status_compatible",
        "ok": true,
        "detail": "under_implementation / under_implementation"
      },
      {
        "check": "denominator_nonzero",
        "ok": true,
        "detail": "denominator = 14500.0"
      }
    ],
    "assumptions": [
      "Inputs are used as verified at their stated verification level."
    ],
    "missing_inputs": [],
    "counterargument": "Reporting boundaries differ by company; a parent/subsidiary split may reflect legal structure rather than economics, since subsidiaries are consolidated.",
    "falsification_test": "The JV/subsidiary renewable amount is shown to be a subset of a different denominator or a different date.",
    "trace": "re_under_implementation_jv_subsidiary = 13791 MW (13791 MW); re_under_implementation_group = 14500 MW; 100 x 13791 / 14500 = 95.1103%; rounding bounds [94.7835%, 95.4394%]",
    "synthetic": false
  },
  {
    "schema_version": "1.0",
    "calculation_id": "calc_dd1caa22ff337a98",
    "signal_family": "renewable_transition",
    "name": "re_share_of_parent_own_pipeline",
    "status": "computed",
    "formula": "parent_re_under_implementation / parent_under_implementation x 100",
    "inputs": [
      {
        "name": "parent_re_under_implementation",
        "value": 709.0,
        "unit": "MW",
        "as_of_date": "2025-03-31",
        "period_text": "As on 31 March 2025",
        "basis": "parent_own",
        "statement_status": "under_implementation",
        "claim_ids": [
          "cl1_0f2c466c2859d4c9cc88f4b8",
          "cl1_7904a68ca446b6be755a6e95"
        ],
        "verification_ids": [
          "ver_re_pipeline_group_cc88f4b8_text",
          "ver_re_pipeline_group_ntpc_ar_fy2024_25",
          "ver_re_pipeline_jv_sub_755a6e95_text",
          "ver_re_pipeline_jv_sub_ntpc_ar_fy2024_25"
        ],
        "verification_outcome": "partially_supported",
        "rounding_uncertainty": 50.0
      },
      {
        "name": "parent_under_implementation",
        "value": 15376.0,
        "unit": "MW",
        "as_of_date": "2025-03-31",
        "period_text": "As on 31 March 2025",
        "basis": "parent_own",
        "statement_status": "under_implementation",
        "claim_ids": [
          "cl1_09d1b0c61a44466b711c57e9",
          "cl1_1528c13ba76ba39d8d47a510"
        ],
        "verification_ids": [
          "ver_pipeline_jv_sub_8d47a510_text",
          "ver_pipeline_jv_sub_ntpc_ar_fy2024_25",
          "ver_pipeline_total_group_711c57e9_text",
          "ver_pipeline_total_group_ntpc_ar_fy2024_25"
        ],
        "verification_outcome": "partially_supported",
        "rounding_uncertainty": null
      }
    ],
    "result": {
      "value": 4.611082,
      "unit": "percent",
      "lower_bound": 4.2859,
      "upper_bound": 4.936264
    },
    "compatibility_checks": [
      {
        "check": "input_verified:parent_re_under_implementation",
        "ok": true,
        "detail": "verification outcome = partially_supported"
      },
      {
        "check": "input_verified:parent_under_implementation",
        "ok": true,
        "detail": "verification outcome = partially_supported"
      },
      {
        "check": "units_compatible",
        "ok": true,
        "detail": "MW vs MW"
      },
      {
        "check": "same_as_of_date",
        "ok": true,
        "detail": "2025-03-31 vs 2025-03-31"
      },
      {
        "check": "basis_compatible",
        "ok": true,
        "detail": "parent_own / parent_own (allowed: [\"('parent_own', 'parent_own')\"])"
      },
      {
        "check": "statement_status_compatible",
        "ok": true,
        "detail": "under_implementation / under_implementation"
      },
      {
        "check": "denominator_nonzero",
        "ok": true,
        "detail": "denominator = 15376.0"
      }
    ],
    "assumptions": [
      "Inputs are used as verified at their stated verification level."
    ],
    "missing_inputs": [],
    "counterargument": "Reporting boundaries differ by company; a parent/subsidiary split may reflect legal structure rather than economics, since subsidiaries are consolidated.",
    "falsification_test": "The parent's own table reports a materially different renewable share than the subtraction implies.",